{
  "contracts": [
    {
      "expected_contract_fingerprint": "1dcc4a7720f22a005ff0eefa7d9d42ec0e68590caea8e8468425d2c26629b414",
      "kind": "rope_position_distinguishability",
      "required_fields": [
        "preset",
        "context_length",
        "exact_discrete_pass",
        "common_collision_gap",
        "total_bank_collision_pair_count",
        "d19_context_range_min_exclusive",
        "d19_context_range_max_inclusive",
        "d19_request_context",
        "d19_proved_request_status",
        "d19_impossible_request_status",
        "d19_undecided_request_status",
        "d19_undecided_margin_open_gap",
        "d19_undecided_margin_interval_width",
        "d19_undecided_request_relation",
        "d19_margin_status_exhaustive",
        "d19_in_range_semantic_trichotomy",
        "d19_proved_first_channel_bank_transfer",
        "d19_proved_first_channel_pair_scope",
        "d19_proved_first_channel_context_wide_contract",
        "d19_proved_first_channel_bank_shape",
        "d19_proved_first_channel_radian_bank_form",
        "d19_proved_first_channel_bank_tolerance_rule"
      ],
      "required_recommendation_action_parameter_paths": {
        "ROPE-AUDIT-EXACT-INTEGER-PHASE-BANK": [
          "preset",
          "context_length",
          "exact_discrete_pass",
          "common_collision_gap",
          "collision_pair_count"
        ],
        "ROPE-USE-D19-MARGIN-FRONTIER": [
          "applicable_context_range.min_exclusive",
          "applicable_context_range.max_inclusive",
          "classifier_regions[region=proved].theorem_ids",
          "classifier_regions[region=undecided_margin_gap].condition",
          "classifier_regions[region=impossible].theorem_ids",
          "undecided_interval.width",
          "proved_branch_bank_transfer.applies",
          "proved_branch_bank_transfer.bank_shape",
          "proved_branch_bank_transfer.context_wide_contract",
          "proved_branch_bank_transfer.radian_bank_form",
          "proved_branch_bank_transfer.theorem_ids"
        ]
      },
      "required_recommendation_action_parameters": {
        "ROPE-AUDIT-EXACT-INTEGER-PHASE-BANK": [
          "preset",
          "context_length",
          "exact_discrete_pass",
          "common_collision_gap",
          "collision_pair_count"
        ],
        "ROPE-USE-D19-MARGIN-FRONTIER": [
          "applicable_context_range",
          "classifier_regions",
          "undecided_interval",
          "proved_branch_bank_transfer"
        ]
      },
      "required_recommendation_evidence_fields": {
        "ROPE-AUDIT-EXACT-INTEGER-PHASE-BANK": [
          "preset",
          "context_length",
          "exact_discrete_pass",
          "common_collision_gap",
          "total_bank_collision_pair_count"
        ],
        "ROPE-USE-D19-MARGIN-FRONTIER": [
          "d19_context_range_min_exclusive",
          "d19_context_range_max_inclusive",
          "d19_request_context",
          "d19_proved_request_status",
          "d19_impossible_request_status",
          "d19_undecided_request_status",
          "d19_undecided_margin_open_gap",
          "d19_undecided_margin_interval_width",
          "d19_undecided_request_relation",
          "d19_margin_status_exhaustive",
          "d19_in_range_semantic_trichotomy",
          "d19_proved_first_channel_bank_transfer",
          "d19_proved_first_channel_pair_scope",
          "d19_proved_first_channel_context_wide_contract",
          "d19_proved_first_channel_bank_shape",
          "d19_proved_first_channel_radian_bank_form",
          "d19_proved_first_channel_bank_tolerance_rule"
        ]
      },
      "required_recommendation_ids": [
        "ROPE-AUDIT-EXACT-INTEGER-PHASE-BANK",
        "ROPE-USE-D19-MARGIN-FRONTIER"
      ],
      "required_recommendation_theorem_ids": {
        "ROPE-AUDIT-EXACT-INTEGER-PHASE-BANK": [
          "AIRA-T0024",
          "AIRA-T0036",
          "AIRA-T0179",
          "AIRA-T0180",
          "AIRA-T0184"
        ],
        "ROPE-USE-D19-MARGIN-FRONTIER": [
          "AIRA-T0171",
          "AIRA-T0172",
          "AIRA-T0216",
          "AIRA-T0231",
          "AIRA-T0233",
          "AIRA-T0234",
          "AIRA-T0235",
          "AIRA-T0236"
        ]
      },
      "required_theorem_ids": [
        "AIRA-T0171",
        "AIRA-T0172",
        "AIRA-T0184",
        "AIRA-T0216",
        "AIRA-T0231",
        "AIRA-T0233",
        "AIRA-T0234",
        "AIRA-T0235",
        "AIRA-T0236"
      ]
    },
    {
      "expected_contract_fingerprint": "89d20fb1753aba81590cbdb4e409b5b55577cc81d00c3318a9f23c293120a33c",
      "kind": "kv_cache_ring_buffer",
      "required_fields": [
        "stale_probe_first_stale_token",
        "sink_tokens_retained_by_policy",
        "sink_window_exact_policy",
        "sink_window_tokens_distinct",
        "sink_prefix_disjoint_from_live_window",
        "sink_tokens_outside_ordinary_rolling_window"
      ],
      "required_recommendation_action_parameter_paths": {
        "KV-DROP-STALE-REQUEST-TOKEN": [
          "target_token"
        ],
        "KV-USE-SINK-ROLLING-WINDOW-REQUEST": [
          "sink_size",
          "request_token_count",
          "request_token_count_bound",
          "cache_size",
          "current"
        ]
      },
      "required_recommendation_action_parameters": {
        "KV-DROP-STALE-REQUEST-TOKEN": [
          "target_token",
          "next_same_slot_overwrite_token"
        ],
        "KV-USE-SINK-ROLLING-WINDOW-REQUEST": [
          "sink_size",
          "request_token_count",
          "request_token_count_bound",
          "cache_size",
          "current"
        ]
      },
      "required_recommendation_evidence_fields": {
        "KV-DROP-STALE-REQUEST-TOKEN": [
          "stale_probe_first_stale_token",
          "stale_probe_stale_requested_count"
        ],
        "KV-USE-SINK-ROLLING-WINDOW-REQUEST": [
          "sink_window_exact_policy",
          "sink_window_tokens_distinct",
          "sink_prefix_disjoint_from_live_window",
          "sink_rolling_tokens_retained",
          "sink_tokens_non_future",
          "sink_tokens_retained_by_policy",
          "sink_tokens_outside_ordinary_rolling_window"
        ]
      },
      "required_recommendation_ids": [
        "KV-DROP-STALE-REQUEST-TOKEN",
        "KV-USE-SINK-ROLLING-WINDOW-REQUEST"
      ],
      "required_recommendation_theorem_ids": {
        "KV-DROP-STALE-REQUEST-TOKEN": [
          "AIM-T0103"
        ],
        "KV-USE-SINK-ROLLING-WINDOW-REQUEST": [
          "AIM-T0104",
          "AIM-T0110",
          "AIM-T0117",
          "AIM-T0136",
          "AIM-T0137",
          "AIM-T0148",
          "AIM-T0149"
        ]
      },
      "required_theorem_ids": [
        "AIM-T0103",
        "AIM-T0149"
      ]
    },
    {
      "expected_contract_fingerprint": "d28f3828ae2780bac707ba07af533b8bc71c3be5d1057213dc5e8293a1e2ed4a",
      "kind": "sparse_attention_coverage",
      "required_fields": [
        "first_uncovered_lag",
        "first_uncovered_interval_start",
        "complete_repair_window",
        "complete_repair_window_covers_context",
        "complete_repair_window_minimal_for_declared_stride_family",
        "complete_repair_window_minimal_witness_lag"
      ],
      "required_recommendation_action_parameter_paths": {
        "SPARSE-DENSE-LOCAL-COMPLETE-FALLBACK": [
          "proposed_local_window",
          "additional_local_slots"
        ],
        "SPARSE-LOCAL-FIRST-INTERVAL-REPAIR": [
          "proposed_local_window"
        ]
      },
      "required_recommendation_action_parameters": {
        "SPARSE-DENSE-LOCAL-COMPLETE-FALLBACK": [
          "proposed_local_window",
          "additional_local_slots"
        ],
        "SPARSE-LOCAL-FIRST-INTERVAL-REPAIR": [
          "proposed_local_window"
        ]
      },
      "required_recommendation_evidence_fields": {
        "SPARSE-DENSE-LOCAL-COMPLETE-FALLBACK": [
          "complete_repair_window",
          "complete_repair_window_covers_context",
          "complete_repair_window_uses_dense_threshold",
          "local_window_complete_threshold_is_exact_local_minimum",
          "complete_repair_window_minimal_for_declared_stride_family",
          "complete_repair_window_minimal_witness_lag"
        ],
        "SPARSE-LOCAL-FIRST-INTERVAL-REPAIR": [
          "first_uncovered_interval_start",
          "first_uncovered_interval_stop"
        ]
      },
      "required_recommendation_ids": [
        "SPARSE-LOCAL-FIRST-INTERVAL-REPAIR",
        "SPARSE-DENSE-LOCAL-COMPLETE-FALLBACK"
      ],
      "required_recommendation_theorem_ids": {
        "SPARSE-DENSE-LOCAL-COMPLETE-FALLBACK": [
          "AIT-T0023",
          "AIT-T0034",
          "AIT-T0172",
          "AIT-T0168",
          "AIT-T0169",
          "AIT-T0170"
        ],
        "SPARSE-LOCAL-FIRST-INTERVAL-REPAIR": [
          "AIT-T0104"
        ]
      },
      "required_theorem_ids": [
        "AIT-T0104",
        "AIT-T0172"
      ]
    },
    {
      "expected_contract_fingerprint": "59e0234bb0ffcb4b63fa83ce5e5ce226216b9a28073183624178cf03ea2f6f52",
      "kind": "recurrence_schedule",
      "required_fields": [
        "periodic_shift_required_steps_invariant",
        "periodic_shift_active_at_step_invariant",
        "total_active_token_work",
        "scheduled_work_saving",
        "scheduled_work_saving_accounting",
        "active_inactive_work_accounting",
        "scheduled_work_saving_positive",
        "post_period_multi_extension_scheduled_work_saving"
      ],
      "required_recommendation_action_parameter_paths": {
        "RECURRENCE-REUSE-WHOLE-PERIOD-SHIFT": [
          "base_token",
          "shifted_token",
          "shift_amount"
        ],
        "RECURRENCE-USE-ACTIVE-TOKEN-WORK-SCHEDULE": [
          "loop_period",
          "token_count",
          "horizon_steps",
          "scheduled_work_saving",
          "post_period_multi_extension_scheduled_work_saving"
        ]